{"description":"Reviews content requested by the coordinator.","id":"reviewer","instructions":{"descriptor":{"digest":"sha256:daaf4fc0ea017bdc02e8b66a8bb6d36e062dbf4f0955f64cb47fcbaa953210fe","mediaType":"text/markdown; charset=utf-8","size":54},"path":"instructions/reviewer.md"},"mediaType":"application/vnd.agentsuite.agent.v1+json","model":{"model":"example-model","protocol":"openai-compatible"},"schemaVersion":"1.0.0-draft"}